{
  "schemaVersion": 1,
  "producer": "platscope-overwolf-companion",
  "observedAt": "2026-08-27T10:15:30Z",
  "gameId": 8954,
  "feature": "match_info",
  "key": "inventory",
  "complete": true,
  "value": {
    "Inventory": {
      "MiscItems": [
        {
          "ItemType": "/Lotus/Test/Part",
          "ItemCount": 2
        }
      ],
      "Upgrades": [
        {
          "ItemType": "/Lotus/Test/Mod",
          "ItemCount": 1,
          "Rank": 10
        }
      ]
    }
  }
}
